Declaration,Result,Constituency,Headline,Link,color
05:05,LAB HOLD,Brent North,labour's Barry Gardiner has held his seat in Brent North.,http://www.bbc.co.uk/news/politics/constituencies/E14000592,#F8A8A7
05:05,LD HOLD,Carshalton & Wallington,Lib Dem Tom Brake has held his seat in Carshalton and Wallington. ,http://www.bbc.co.uk/news/politics/constituencies/E14000621,#FBCD82
05:05,CON HOLD,Epping Forest,Eleanor Laing has retained her Epping Forest seat. ,http://www.bbc.co.uk/news/politics/constituencies/E14000693,#B8C6D7
05:05,CON HOLD,Old Bexley & Sidcup,James Brokenshire has defended his Old Bexley and Sidcup seat.,http://www.bbc.co.uk/news/politics/constituencies/E14000869,#B8C6D7
05:05,CON GAIN FROM LD,Sutton & Cheam,Conservative Paul Scully has managed to oust the Liberal Democrats in Sutton and Cheam.,http://www.bbc.co.uk/news/politics/constituencies/E14000984,#B8C6D7
05:05,LAB HOLD,West Ham,Lyn Brown has retained her Labour seat in West Ham with a 68.4% share of the votes.,http://www.bbc.co.uk/news/politics/constituencies/E14001032,#F8A8A7
05:06,CON GAIN FROM LD,Bath,Bath is blue again,http://www.bbc.co.uk/news/politics/constituencies/E14000547,#B8C6D7
05:06,CON HOLD,Surrey East,The Conservatives hold Surrey East.,http://www.bbc.co.uk/news/politics/constituencies/E14000681,#B8C6D7
05:06,LAB HOLD,Sheffield Central,Paul Blomfield has held Sheffield Central for Labour.,http://www.bbc.co.uk/news/politics/constituencies/E14000919,#F8A8A7
05:07,CON HOLD,Broxtowe,Anna Soubry has held her seat in Broxtowe for the Conservatives.,http://www.bbc.co.uk/news/politics/constituencies/E14000607,#B8C6D7
05:09,LAB HOLD,Blackpool South,"Gordon Marsden holds Blackpool South for Labour with a majority of 2,585.",http://www.bbc.co.uk/news/politics/constituencies/E14000573,#F8A8A7
05:09,LAB HOLD,Dudley North,The so-called "three-way marginal" in Dudley North has been held by Labour's Ian Austin.,http://www.bbc.co.uk/news/politics/constituencies/E14000671,#F8A8A7
05:09,LAB HOLD,Tynemouth,Alan Campbell has held Tynemouth for Labour.,http://www.bbc.co.uk/news/politics/constituencies/E14001006,#F8A8A7
05:10,CON HOLD,Northampton South,Conservatives hold on to Northampton South.,http://www.bbc.co.uk/news/politics/constituencies/E14000862,#B8C6D7
05:10,CON HOLD,Suffolk West,Matthew Hancock holds Suffolk West for the Conservatives.,http://www.bbc.co.uk/news/politics/constituencies/E14001034,#B8C6D7
05:11,CON HOLD,Cannock Chase,Amanda Milling has held onto Cannock Chase for the Conservatives after Aidan Burley decided not to stand again.,http://www.bbc.co.uk/news/politics/constituencies/E14000618,#B8C6D7
05:11,LAB HOLD,Slough,Fiona Mactaggart holds Slough for Labour.,http://www.bbc.co.uk/news/politics/constituencies/E14000930,#F8A8A7
05:11,CON HOLD,Tamworth,"The winning Conservative candidate for Tamworth, Christopher Pincher, accepts victory.",http://www.bbc.co.uk/news/politics/constituencies/E14000986,#B8C6D7
05:11,CON HOLD,Wycombe,Conservatives hold Wycombe.,http://www.bbc.co.uk/news/politics/constituencies/E14001056,#B8C6D7
05:12,CON GAIN FROM LAB,Gower,Conservatives gain Gower,http://www.bbc.co.uk/news/politics/constituencies/W07000046,#B8C6D7
05:12,SNP GAIN FROM LD,Edinburgh West,SNP gain Edinburgh West from the Liberal Democrats,http://www.bbc.co.uk/news/politics/constituencies/S14000026,#FEE280
05:12,LAB HOLD,Worsley & Eccles South,Labour's Barbara Keeley retains Worsley & Eccles South.,http://www.bbc.co.uk/news/politics/constituencies/E14001054,#F8A8A7
05:13,LAB HOLD,Barking,Labour's Margaret Hodge has held onto her Barking seat after securing 57.7% of the vote share. ,http://www.bbc.co.uk/news/politics/constituencies/E14000540,#F8A8A7
05:13,LAB HOLD,Hackney North & Stoke Newington,Diane Abbott has been re-elected in her Hackney North and Stoke Newington constituency for Labour after securing a 62.9% share of the vote. ,http://www.bbc.co.uk/news/politics/constituencies/E14000720,#F8A8A7
05:13,LAB HOLD,Harrow West,Gareth Thomas has been re-elected for Harrow West for the Labour party.,http://www.bbc.co.uk/news/politics/constituencies/E14000732,#F8A8A7
05:13,CON HOLD,Watford,Richard Harrington has been elected to Watford for the Conservative's with a 43.5% share of the votes. ,http://www.bbc.co.uk/news/politics/constituencies/E14001021,#B8C6D7
05:14,SNP GAIN FROM LAB,Dumfries & Galloway,SNP gain Dumfries and Galloway from Labour,http://www.bbc.co.uk/news/politics/constituencies/S14000013,#FEE280
05:14,CON HOLD,Folkestone & Hythe,The Conservatives hold Folkestone & Hythe.,http://www.bbc.co.uk/news/politics/constituencies/E14000704,#B8C6D7
05:14,LAB HOLD,Hackney South & Shoreditch,Labour's Me Hillier has been re-elected into her Hackney South and Shoreditch seat.,http://www.bbc.co.uk/news/politics/constituencies/E14000721,#F8A8A7
05:14,CON HOLD,Hampshire North West,Hampshire North West is held by the Conservatives' Kit Malthouse.,http://www.bbc.co.uk/news/politics/constituencies/E14000857,#B8C6D7
05:14,CON HOLD,Orpington,"Jo Johnson, Boris Johnson's younger brother, has retained his Orpington seat for the Conservative's.  ",http://www.bbc.co.uk/news/politics/constituencies/E14000872,#B8C6D7
05:14,LAB HOLD,Workington,Sue Hayman has been elected MP for Workington keeping the seat for Labour - Cumbria's first female MP.,http://www.bbc.co.uk/news/politics/constituencies/E14001053,#F8A8A7
05:15,CON HOLD,Basingstoke,Maria Miller holds Basingstoke for the Conservatives.,http://www.bbc.co.uk/news/politics/constituencies/E14000545,#B8C6D7
05:15,LAB HOLD,Copeland,Labour's Jamie Reed has held Copeland.,http://www.bbc.co.uk/news/politics/constituencies/E14000647,#F8A8A7
05:15,LAB HOLD,Hayes & Harlington,John McDonnell has been re-elected for Labour in Hayes and Harlington.,http://www.bbc.co.uk/news/politics/constituencies/E14000737,#F8A8A7
05:15,LAB HOLD,Wolverhampton North East,"Emma Reynolds has boosted her majority in Wolverhampton North East by 3,011.",http://www.bbc.co.uk/news/politics/constituencies/E14001049,#F8A8A7
05:16,CON HOLD,Brentwood & Ongar,Conservative Eric Pickles is re-elected in Brentwood and Ongar.,http://www.bbc.co.uk/news/politics/constituencies/E14000594,#B8C6D7
05:17,CON HOLD,Hitchin & Harpenden,Peter Lilley has held the seat of Hitchin and Harpenden for the Conservatives.,http://www.bbc.co.uk/news/politics/constituencies/E14000749,#B8C6D7
05:18,LAB HOLD,Birmingham Hodge Hill,"A victory in Birmingham Hodge Hill for Labour's Liam Byrne with a majority of more than 20,000",http://www.bbc.co.uk/news/politics/constituencies/E14000563,#F8A8A7
05:18,CON HOLD,High Peak,Conservative Andrew Bingham retains High Peak,http://www.bbc.co.uk/news/politics/constituencies/E14000748,#B8C6D7
05:18,LAB HOLD,Sheffield Heeley,Louise Haigh holds Sheffield Heeley for Labour.,http://www.bbc.co.uk/news/politics/constituencies/E14000923,#F8A8A7
05:19,CON HOLD,Bury North,Conservative David Nuttall retains Bury North after a recount.,http://www.bbc.co.uk/news/politics/constituencies/E14000611,#B8C6D7
05:19,LAB HOLD,Camberwell & Peckham,Harriet Harman will be back in office for the Labour party after being re-elected in Camberwell and Peckham.,http://www.bbc.co.uk/news/politics/constituencies/E14000615,#F8A8A7
05:19,LAB HOLD,"Normanton, Pontefract & Castleford","Shadow Home Secretary Yvette Cooper has held her Labour seat of Normanton, Pontefract & Castleford.",http://www.bbc.co.uk/news/politics/constituencies/E14000836,#F8A8A7
05:20,SNP GAIN FROM LD,"Ross, Skye & Lochaber","SNP gain Ross, Skye and Lochaber from the Liberal Democrats",http://www.bbc.co.uk/news/politics/constituencies/S14000055,#FEE280
05:20,CON HOLD,Stratford-on-Avon,Nadhim Zahawi has held Stratford-on-Avon for the Conservatives.,http://www.bbc.co.uk/news/politics/constituencies/E14000977,#B8C6D7
05:21,CON HOLD,Wealden,The Conservatives have held Wealden.,http://www.bbc.co.uk/news/politics/constituencies/E14001023,#B8C6D7
05:23,LAB GAIN FROM CON,Brentford & Isleworth,Labour's Ruth Cadbury has won her Brentford and Isleworth seat ousting the Conservative's. ,http://www.bbc.co.uk/news/politics/constituencies/E14000593,#F8A8A7
05:23,CON HOLD,Chipping Barnet,Conservative Theresa Villiers has defended her Chipping Barnet seat. ,http://www.bbc.co.uk/news/politics/constituencies/E14000636,#B8C6D7
05:23,LAB HOLD,Croydon North,Steve Reed has defended his Croydon North seat for the Labour party.,http://www.bbc.co.uk/news/politics/constituencies/E14000655,#F8A8A7
05:23,LAB HOLD,Hampstead & Kilburn,Tulip Siddiq has held on to her Labour seat in Hampstead and Kilburn.,http://www.bbc.co.uk/news/politics/constituencies/E14000727,#F8A8A7
05:23,CON HOLD,Sleaford & North Hykeham,Stephen Phillips has successfully held his Sleaford and North Hykeham seat.,http://www.bbc.co.uk/news/politics/constituencies/E14000929,#B8C6D7
05:24,CON GAIN FROM LAB,Bolton West,Chris Green beats Julie Hilling to win Bolton West for the Conservatives.,http://www.bbc.co.uk/news/politics/constituencies/E14000580,#B8C6D7
05:24,LAB HOLD,Poplar & Limehouse,Labour's Jim Fitzpatrick retains his seat in Poplar and Limehouse.,http://www.bbc.co.uk/news/politics/constituencies/E14000882,#F8A8A7
05:25,UUP GAIN FROM SF,Fermanagh & South Tyrone,UUP's Tom Elliott is elected in Fermanagh & South Tyrone by just over 500 votes.,http://www.bbc.co.uk/news/politics/constituencies/N06000007,#FFFFFF
05:25,CON HOLD,Altrincham & Sale West,Graham Brady holds Altrincham and Sale West for Conservatives.,http://www.bbc.co.uk/news/politics/constituencies/E14000532,#B8C6D7
05:25,CON HOLD,Scarborough & Whitby,"Conservative Robert Goodwill has been re-elected in Scarborough and Whitby with a majority of 6,200.",http://www.bbc.co.uk/news/politics/constituencies/E14000913,#B8C6D7
05:25,LAB HOLD,Sheffield South East,Sheffield South East has been held by Clive Betts MP. ,http://www.bbc.co.uk/news/politics/constituencies/E14000920,#F8A8A7
05:26,LAB HOLD,Birmingham Selly Oak,Steve McCabe has held Birmingham Selly Oak for Labour.,http://www.bbc.co.uk/news/politics/constituencies/E14000567,#F8A8A7
05:26,CON HOLD,Lichfield,Michael Fabricant has marginally increased his majority - by 506 - as he has held Lichfield for the Conservatives.,http://www.bbc.co.uk/news/politics/constituencies/E14000791,#B8C6D7
05:27,LAB HOLD,Huddersfield,"Barry Sheerman has held Huddersfield, a safe Labour seat. That's the ninth time he's won it.",http://www.bbc.co.uk/news/politics/constituencies/E14000756,#F8A8A7
05:28,CON GAIN FROM LD,Hazel Grove,"William Wragg wins Hazel Grove for the Tories with a majority of 6,552 and a swing of 15.2% from the Lib Dems,",http://www.bbc.co.uk/news/politics/constituencies/E14000738,#B8C6D7
05:28,CON HOLD,Norfolk Mid,George Freeman holds the Norfolk Mid seat for the Conservatives.,http://www.bbc.co.uk/news/politics/constituencies/E14000816,#B8C6D7
05:29,CON HOLD,Finchley & Golders Green,Conservative Mike Freer will continue to serve the constituents of Finchley and Golders Green  after getting re-elected. ,http://www.bbc.co.uk/news/politics/constituencies/E14000703,#B8C6D7
05:29,LAB HOLD,Holborn & St Pancras,Labour's Keir Starmer has defended his Holborn and St Pancras seat despite going up against Green Party leader Natalie Bennett.,http://www.bbc.co.uk/news/politics/constituencies/E14000750,#F8A8A7
05:29,CON HOLD,Somerset North East,"Jacob Rees-Mogg holds the Somerset North East for the Tories with 25,431 votes. Labour's Todd Foreman has half as many votes - 12,690. ",http://www.bbc.co.uk/news/politics/constituencies/E14000846,#B8C6D7
05:29,LAB HOLD,Wolverhampton South East,"Labour has also held Wolverhampton South East with its man Pat McFadden, increasing his majority by 4,174.",http://www.bbc.co.uk/news/politics/constituencies/E14001050,#F8A8A7
05:30,CON GAIN FROM LAB,Plymouth Moor View,"Conservative Johnny Mercer has been elected in Plymouth Moor View with 16,020 votes. ",http://www.bbc.co.uk/news/politics/constituencies/E14000879,#B8C6D7
05:30,CON HOLD,St Albans,Conservatives hold St Albans.,http://www.bbc.co.uk/news/politics/constituencies/E14000960,#B8C6D7
05:31,LAB GAIN FROM LD,Birmingham Yardley,The elephant in the room was John Hemming telling BBC WM hours ago he believed he had lost his seat. And that's now been confirmed as a Labour gain for Jess Phillips.,http://www.bbc.co.uk/news/politics/constituencies/E14000568,#F8A8A7
05:31,CON HOLD,Sevenoaks,Defence Secretary Michael Fallon has held Sevenoaks for the Conservatives.,http://www.bbc.co.uk/news/politics/constituencies/E14000918,#B8C6D7
05:32,SF HOLD,Newry & Armagh,Mickey Brady is elected in Newry & Armagh. ,http://www.bbc.co.uk/news/politics/constituencies/N06000011,#FFFFFF
05:32,LAB HOLD,Bassetlaw,John Mann has retained his Bassetlaw seat for Labour.,http://www.bbc.co.uk/news/politics/constituencies/E14000546,#F8A8A7
05:32,CON HOLD,Newbury,Richard Benyon holds Newbury for the Conservatives.,http://www.bbc.co.uk/news/politics/constituencies/E14000830,#B8C6D7
05:32,LAB GAIN FROM LD,Norwich South,"Labour candidate Clive Lewis won Norwich South from former Liberal Democrat MP Simon Wright, who was beaten into fourth place.",http://www.bbc.co.uk/news/politics/constituencies/E14000864,#F8A8A7
05:33,CON HOLD,Vale of Glamorgan,Conservatives hold Vale of Glamorgan,http://www.bbc.co.uk/news/politics/constituencies/W07000078,#B8C6D7
05:34,CON HOLD,Brigg & Goole,The Conservatives Andrew Percy has held his seat in Brigg & Goole with a "huge majority".,http://www.bbc.co.uk/news/politics/constituencies/E14000596,#B8C6D7
05:34,CON HOLD,Guildford,The Conservatives hold Guildford.,http://www.bbc.co.uk/news/politics/constituencies/E14000719,#B8C6D7
05:34,CON HOLD,Hornchurch & Upminster,Conservative Angela Watkinson defends her Hornchurch and Upminster seat. ,http://www.bbc.co.uk/news/politics/constituencies/E14000751,#B8C6D7
05:34,LAB HOLD,Lewisham West & Penge,Labour's Jim Dowd will continue to work for Lewisham West and Penge's constituents after defending his seat.,http://www.bbc.co.uk/news/politics/constituencies/E14000788,#F8A8A7
05:34,CON HOLD,Romford,Conservative Andrew Rosindell has defended his Romford seat. ,http://www.bbc.co.uk/news/politics/constituencies/E14000900,#B8C6D7
05:34,LAB HOLD,Sheffield Brightside & Hillsborough,Harry Harpham has held Sheffield Brightside & Hillsborough for Labour.,http://www.bbc.co.uk/news/politics/constituencies/E14000921,#F8A8A7
05:37,LAB HOLD,Ashfield,Gloria De Piero has successfully defended her Ashfield seat for Labour.,http://www.bbc.co.uk/news/politics/constituencies/E14000535,#F8A8A7
05:37,CON HOLD,Eddisbury,Antoinette Sandbach holds Eddisbury for Conservative Party.  New MP for constituency after previous MP Steven O'Brien steps down to take another post.,http://www.bbc.co.uk/news/politics/constituencies/E14000686,#B8C6D7
05:37,LAB HOLD,Liverpool Walton,Steve Rotheram retains Liverpool Walton for Labour with an increased majority.,http://www.bbc.co.uk/news/politics/constituencies/E14000794,#F8A8A7
05:37,LAB GAIN FROM LD,Manchester Withington,Jeff Smith beats Lib Dem John Leech to win Manchester Withington for Labour.  ,http://www.bbc.co.uk/news/politics/constituencies/E14000809,#F8A8A7
05:37,CON HOLD,Wyre & Preston North,Tory Ben Wallace retains Wyre and Preston North with a #F8A8A7uced majority.,http://www.bbc.co.uk/news/politics/constituencies/E14001057,#B8C6D7
05:38,CON HOLD,Ashford,The Conservatives have held Ashford.,http://www.bbc.co.uk/news/politics/constituencies/E14000536,#B8C6D7
05:38,CON HOLD,Woking,The Conservatives hold Woking.,http://www.bbc.co.uk/news/politics/constituencies/E14001047,#B8C6D7
05:39,CON GAIN FROM LD,Thornbury & Yate,"Lib Dem pension minister Steve Webb loses Thornbury and Yate by 1,500 votes to Luke Hall of the Conservatives.",http://www.bbc.co.uk/news/politics/constituencies/E14000994,#B8C6D7
05:39,CON HOLD,Wokingham,John Redwood holds Wokingham for the Conservatives.,http://www.bbc.co.uk/news/politics/constituencies/E14001048,#B8C6D7
05:39,LAB GAIN FROM CON,Wolverhampton South West,"Rob Marris has been re-elected as MP for Wolverhampton South West, winning the seat back from Tory Paul Uppal.",http://www.bbc.co.uk/news/politics/constituencies/E14001051,#F8A8A7
05:40,SNP GAIN FROM LD,Argyll & Bute,SNP gain Argyll and Bute from the Liberal Democrats,http://www.bbc.co.uk/news/politics/constituencies/S14000005,#FEE280
05:41,LAB HOLD,Bethnal Green & Bow,Labour has retained its Bethnal Green and Bow seat with Ali Rushanara getting voted back in for another term. ,http://www.bbc.co.uk/news/politics/constituencies/E14000555,#F8A8A7
05:41,CON HOLD,Bosworth,David Tredinnick has retained his Bosworth seat in Leicestershire for the Conservatives.,http://www.bbc.co.uk/news/politics/constituencies/E14000583,#B8C6D7
05:41,LAB HOLD,Feltham & Heston,Labour's Seema Malhotra has retained her Feltham and Heston seat winning with a share of 52.3%. ,http://www.bbc.co.uk/news/politics/constituencies/E14000701,#F8A8A7
05:41,CON GAIN FROM LD,Somerton & Frome,"Tory David Warburton wins Somerton and Frome with a massive majority of 20,000. The nearest was David Rendel for the Lib Dems.",http://www.bbc.co.uk/news/politics/constituencies/E14000932,#B8C6D7
05:42,CON HOLD,Witney,David Cameron holds his Witney seat for the Conservatives.,http://www.bbc.co.uk/news/politics/constituencies/E14001046,#B8C6D7
05:43,LAB GAIN FROM LD,Bradford East,Labour have won the Bradford East seat previously held by the Liberal Democrats' David Ward.,http://www.bbc.co.uk/news/politics/constituencies/E14000587,#F8A8A7
05:43,LAB HOLD,Oldham East & Saddleworth,"Labour's Debbie Abrahams is re-elected in the Oldham East & Saddleworth seat with a majority of 6,002 and swing of 4%.",http://www.bbc.co.uk/news/politics/constituencies/E14000870,#F8A8A7
05:43,CON HOLD,Romsey & Southampton North,Caroline Nokes holds Romsey and Southampton North for the Conservatives.,http://www.bbc.co.uk/news/politics/constituencies/E14000901,#B8C6D7
05:43,CON HOLD,Tonbridge & Malling,The Conservatives hold Tonbridge & Malling.,http://www.bbc.co.uk/news/politics/constituencies/E14000997,#B8C6D7
05:44,CON HOLD,Bracknell,Phillip Lee holds Bracknell for the Conservatives.,http://www.bbc.co.uk/news/politics/constituencies/E14000586,#B8C6D7
05:44,LAB HOLD,Bristol East,The first win of the night for Labour in the West. Kerry McCarthy holds Bristol East.,http://www.bbc.co.uk/news/politics/constituencies/E14000599,#F8A8A7
05:44,CON GAIN FROM LD,Colchester,Sir Bob Russell has been defeated in Colchester by Conservative candidate Will Quince.,http://www.bbc.co.uk/news/politics/constituencies/E14000644,#B8C6D7
05:44,LAB HOLD,Doncaster Central,Rosie Winterton holds Doncaster Central for Labour.,http://www.bbc.co.uk/news/politics/constituencies/E14000668,#F8A8A7
05:45,CON HOLD,Christchurch,Christopher Chope holds Christchurch for the Conservatives.,http://www.bbc.co.uk/news/politics/constituencies/E14000638,#B8C6D7
05:46,CON HOLD,Braintree,Conservatives hold Braintree.,http://www.bbc.co.uk/news/politics/constituencies/E14000590,#B8C6D7
05:46,CON HOLD,Filton & Bradley Stoke,Jack Lopresti retains the seat for the Tories in Filton and Bradley Stoke.,http://www.bbc.co.uk/news/politics/constituencies/E14000702,#B8C6D7
05:48,CON HOLD,Fylde,"Conservative Mark Menzies retains Fylde with a majority of 13,224.",http://www.bbc.co.uk/news/politics/constituencies/E14000706,#B8C6D7
05:49,LAB HOLD,Birmingham Ladywood,Labour's Shabana Mahmood holds Birmingham Ladywood.,http://www.bbc.co.uk/news/politics/constituencies/E14000564,#F8A8A7
05:49,CON HOLD,Penrith & The Border,Rory Stewart has retained Penrith and the Border for the Conservatives.,http://www.bbc.co.uk/news/politics/constituencies/E14000877,#B8C6D7
05:51,CON HOLD,Blackpool North & Cleveleys,"Conservative Paul Maynard retains Blackpool North & Cleveleys with an increased 3,340 majority.",http://www.bbc.co.uk/news/politics/constituencies/E14000572,#B8C6D7
05:51,LAB HOLD,Ellesmere Port & Neston,"Labour's Justin Madders wins for Labour in Ellesmere Port & Neston with a majority of 6,275.",http://www.bbc.co.uk/news/politics/constituencies/E14000688,#F8A8A7
05:51,CON GAIN FROM LD,Cornwall North,"Scott Mann takes the seat from the Liberal Democrats with 21,000 votes.",http://www.bbc.co.uk/news/politics/constituencies/E14000837,#B8C6D7
05:51,CON HOLD,Skipton & Ripon,Skipton & Ripon has been held by the Conservatives' Julian Smith. ,http://www.bbc.co.uk/news/politics/constituencies/E14000928,#B8C6D7
05:51,CON HOLD,Totnes,"Sarah Wollaston has been elected in Totnes with 24,941 votes.",http://www.bbc.co.uk/news/politics/constituencies/E14001001,#B8C6D7
05:52,CON HOLD,Croydon South,The Conservatives have held their Croydon South seat and will be ushering in new MP Chris Philp.,http://www.bbc.co.uk/news/politics/constituencies/E14000656,#B8C6D7
05:52,CON HOLD,Worcestershire Mid,Nigeld Huddlestone is elected as the MP for Worcestershire Mid,http://www.bbc.co.uk/news/politics/constituencies/E14000818,#B8C6D7
05:53,LAB HOLD,Salford & Eccles,"Labour's Rebecca Long-Bailey holds Salford & Eccles with a majority of 12,541.",http://www.bbc.co.uk/news/politics/constituencies/E14000911,#F8A8A7
05:54,LAB HOLD,Bolton North East,"Labour's David Crausby retains Bolton North East with a majority of 4,377",http://www.bbc.co.uk/news/politics/constituencies/E14000578,#F8A8A7
05:54,LAB HOLD,Manchester Central,"Lucy Powell retains Manchester Central with an increased majority of 18,639.",http://www.bbc.co.uk/news/politics/constituencies/E14000807,#F8A8A7
05:54,CON HOLD,Ribble Valley,"Conservative Nigel Evans holds Ribble Valley with a #F8A8A7uced majority of 13,606",http://www.bbc.co.uk/news/politics/constituencies/E14000894,#B8C6D7
05:54,CON GAIN FROM LD,Solihull,"Lorely Burt has lost her seat to the Conservatives' Julian Knight in Solihull, meaning the Lib Dems' foothold in the region has been wiped out.",http://www.bbc.co.uk/news/politics/constituencies/E14000931,#B8C6D7
05:54,CON HOLD,Welwyn Hatfield,Tory party chairman Grant Shapps holds Welwyn Hatfield.,http://www.bbc.co.uk/news/politics/constituencies/E14001027,#B8C6D7
05:54,CON GAIN FROM LD,Yeovil,"Tory Marcus Fysh (24,178 votes) takes Yeovil, ousting previous MP, David Laws, of the Liberal Democrats (18,865 votes).",http://www.bbc.co.uk/news/politics/constituencies/E14001060,#B8C6D7
05:55,LAB HOLD,Don Valley,Shadow cabinet member Caroline Flint has held Don Valley for Labour.,http://www.bbc.co.uk/news/politics/constituencies/E14000667,#F8A8A7
05:55,LAB HOLD,Sefton Central,"Labour's Bill Esterson is re-relected in the Sefton Central seat with a majority of 11,846.",http://www.bbc.co.uk/news/politics/constituencies/E14000916,#F8A8A7
05:55,LAB HOLD,Stockport,"Labour's Ann Coffey holds Stockport with a majority of 10,061.",http://www.bbc.co.uk/news/politics/constituencies/E14000969,#F8A8A7
05:56,SNP GAIN FROM LD,"Inverness, Nairn, Badenoch & Strathspey","SNP gain Inverness, Nairn, Badenoch and Strathspey from the Liberal Democrats",http://www.bbc.co.uk/news/politics/constituencies/S14000039,#FEE280
05:56,CON HOLD,Bournemouth West,Conor Burns holds Bournemouth West for the Conservatives.,http://www.bbc.co.uk/news/politics/constituencies/E14000585,#B8C6D7
05:56,LAB GAIN FROM LD,Cambridge,Labour's Daniel Zeichner defeats former MP Julian Huppert in Cambridge.,http://www.bbc.co.uk/news/politics/constituencies/E14000617,#F8A8A7
05:57,CON HOLD,Harwich & Essex North,Conservative Bernard Jenkin is re-elected in Harwich and Essex North.,http://www.bbc.co.uk/news/politics/constituencies/E14000734,#B8C6D7
05:57,CON HOLD,Sherwood,Mark Spencer has held his Sherwood constituency for the Conservatives.,http://www.bbc.co.uk/news/politics/constituencies/E14000924,#B8C6D7
06:00,LAB HOLD,Birmingham Edgbaston,"Gisela Stuart, in Birmingham Edgbaston, was cheerful and positive after we interviewed her earlier for BBC WM. Now we know she has kept her seat for Labour.",http://www.bbc.co.uk/news/politics/constituencies/E14000560,#F8A8A7
06:00,CON GAIN FROM LAB,Corby,Conservative Tom Pursglove defeats Labour's Andy Sawford in Corby.,http://www.bbc.co.uk/news/politics/constituencies/E14000648,#B8C6D7
06:00,LAB HOLD,Penistone & Stocksbridge,Angela Smith holds Penistone & Stocksbridge for Labour.,http://www.bbc.co.uk/news/politics/constituencies/E14000876,#F8A8A7
06:02,CON HOLD,Maidenhead,Theresa May holds Maidenhead for the Conservatives.,http://www.bbc.co.uk/news/politics/constituencies/E14000803,#B8C6D7
06:03,LAB HOLD,Bristol South,Labour's second hold of the night in the West. Both in Bristol area. ,http://www.bbc.co.uk/news/politics/constituencies/E14000601,#F8A8A7
06:06,CON HOLD,Redditch,Karen Lumley retains the Redditch MP with an increased majority.,http://www.bbc.co.uk/news/politics/constituencies/E14000892,#B8C6D7
06:07,LAB GAIN FROM RESPECT,Bradford West,George Galloway has lost his seat in Bradford West to Labour's Naz Shah.,http://www.bbc.co.uk/news/politics/constituencies/E14000589,#F8A8A7
06:07,LAB HOLD,Leicester South,Jonathan Ashworth returns as Labour MP for Leicester South.,http://www.bbc.co.uk/news/politics/constituencies/E14000783,#F8A8A7
06:08,LAB HOLD,Birmingham Hall Green,"Roger Godsiff has boosted his majority by 16,019 in defending Birmingham Hall Green for Labour.",http://www.bbc.co.uk/news/politics/constituencies/E14000562,#F8A8A7
06:08,CON HOLD,Hampshire East,Damian Hinds holds Hampshire East for the Conservatives,http://www.bbc.co.uk/news/politics/constituencies/E14000680,#B8C6D7
06:08,CON HOLD,Maidstone & The Weald,Conservatives hold Maidstone & The Weald.,http://www.bbc.co.uk/news/politics/constituencies/E14000804,#B8C6D7
06:08,CON HOLD,Saffron Walden,Conservative Alan Haselhurst is re-elected in Saffron Walden.,http://www.bbc.co.uk/news/politics/constituencies/E14000910,#B8C6D7
